{
  "gameId": "kilnspire",
  "gameName": "Kilnspire",
  "projectSlug": "kilnspire",
  "gameVersion": "1.0.0",
  "mathVersion": "1.0.0",
  "configHash": "sha256:07dd4c06376d22cc22bbb24708e1715c4297a544a9dea7533962681a670b2484",
  "grid": {
    "columns": 5,
    "rows": 4
  },
  "winEvaluation": {
    "mode": "ways"
  },
  "bet": {
    "defaultCurrency": "EUR",
    "minBetMinor": 10,
    "maxBetMinor": 10000,
    "betLevelsMinor": [
      10,
      20,
      50,
      100,
      200,
      500,
      1000,
      2000,
      5000,
      10000
    ],
    "defaultBetMinor": 100
  },
  "maxWinXBet": 10000,
  "rtpProfiles": [
    {
      "profileId": "rtp-96",
      "targetRtp": 0.96,
      "default": true
    }
  ],
  "configFileRefs": {
    "symbols": "symbols.json",
    "paytable": "paytable.json",
    "reelSets": "reel-sets.json",
    "scatterTiers": "scatter-tiers.json",
    "features": "features.json",
    "bonusBuys": "bonus-buys.json",
    "spinPresentation": "spin-presentation.json",
    "autoplay": "autoplay.json",
    "jurisdictionPolicies": "jurisdiction-policies.json",
    "stateMachine": "state-machine.json",
    "animationEvents": "animation-events.json",
    "audioEvents": "audio-events.json",
    "assetManifest": "asset-manifest.json",
    "deviceProfiles": "device-profiles.json"
  }
}
